Book ID,Title,Author,Category,Price (Rs.),ISBN,Cover Image URL,In Stock,View Count,Rating,Search Tags,Search Count,Branch,Current Stock,Daily Sales,Branch Demand Score,Trend Score,Trend Label
REAL-223,හේඩීස්ගේ දෙවොල (Hadesge Devola),රික් රයෝර්ඩන් - පරි. රූපේනි මානිංගමුව,යොවුන් නවකතා (Young Adult),2250,978-955-697-343-3,/images/books/hadesge_devola.jpg,TRUE,520,4.8,"හේඩීස්ගේ දෙවොල, Hadesge Devola, The House of Hades",233,Colombo,46,25,160.2,119.14,High Demand
REAL-224,මායාකාරියෝ (Mayakariyo - The Witches),රෝල්ඩ් ඩාල්,ළමා නවකතා,950,955-570-405-8,/images/books/mayakariyo.jpg,TRUE,850,4.8,"මායාකාරියෝ, Mayakariyo, The Witches, රෝල්ඩ් ඩාල්",175,Colombo,46,20,148.5,115.6,High Demand
REAL-225,මැටිල්ඩා (Matilda),රෝල්ඩ් ඩාල් - පරි. උපාලි උබයසේකර,ළමා නවකතා,985,978-955-570-649-0,/images/books/matilda.jpg,TRUE,920,4.9,"මැටිල්ඩා, Matilda, රෝල්ඩ් ඩාල්, Roald Dahl",100,Galle,69,23,142.6,108.22,High Demand
REAL-226,මැලෝරි ටවර්ස් (Malory Towers),ඊනිඩ් බ්ලයිටන්,ළමා නවකතා,1150,978-624-5713-43-1,/images/books/malory_towers_1.jpg,TRUE,340,4.5,"මැලෝරි ටවර්ස්, Malory Towers, ඊනිඩ් බ්ලයිටන්",35,Galle,70,30,122.2,84.74,High Demand
REAL-227,මැලෝරි ටවර්ස් (Malory Towers),ඊනිඩ් බ්ලයිටන්,ළමා නවකතා,850,978-955-708-122-9,/images/books/malory_towers_2.jpg,TRUE,310,4.4,"මැලෝරි ටවර්ස්, Malory Towers, ඊනිඩ් බ්ලයිටන්",115,Kandy,12,11,98.3,84.56,High Demand
REAL-228,නැන්සි කෲ: ටෙඩි බෙයාර් අබිරහස,කැරොලයින් කීන්,පරිවර්තන (Translation),750,978-955-657-006-8,/images/books/nancy_drew_teddy_bear.jpg,TRUE,450,4.6,"නැන්සි කෲ, Nancy Drew, ටෙඩි බෙයාර් අබිරහස",104,Colombo,54,25,130.3,96.06,High Demand
REAL-229,නැන්සි කෲ: ෆින්ලේ මැදුරේ ද්විත්ව අබිරහස,කැරොලයින් කීන්,පරිවර්තන (Translation),750,978-955-657-078-6,/images/books/nancy_drew_fenley_place.jpg,TRUE,410,4.5,"නැන්සි කෲ, Nancy Drew, ෆින්ලේ මැදුරේ ද්විත්ව අබිරහස",259,Kandy,31,20,149.1,113.82,High Demand
REAL-230,මා බාල කාලේ (Ma Bala Kale),මැක්සිම් ගෝර්කි - පරි. ඒ.වී. ජයරත්න,පරිවර්තන (Translation),750,978-955-1311-11-7,/images/books/ma_bala_kale.jpg,TRUE,380,4.7,"මා බාල කාලේ, Ma Bala Kale, මැක්සිම් ගෝර්කි",102,Galle,45,1,80.8,76.86,Moderate Demand
REAL-231,විජයබා කොල්ලය (Vijayaba Kollaya),ඩබ්ලිව්. ඒ. සිල්වා,නවකතා (Novel),1230,978-955-31-1656-7,/images/books/vijayaba_kollaya.jpg,TRUE,920,4.9,"විජයබා කොල්ලය, Vijayaba Kollaya, ඩබ්ලිව්. ඒ. සිල්වා",275,Kandy,31,29,189.6,141.32,High Demand
REAL-232,අගමෙහෙසිය (Agamehesiya),ජයකොඩි සෙනෙවිරත්න,නවකතා (Novel),650,978-955-686-087-0,/images/books/agamehesiya.jpg,TRUE,540,4.6,"අගමෙහෙසිය, Agamehesiya, ජයකොඩි සෙනෙවිරත්න",209,Kandy,27,7,118,101.4,High Demand
